headline,teaser,original_content,yandex_generated_neutral_approach,yandex_generated_tass_approach,yandex_generated_tvrain_approach,yandex_generated_universal_approach
В ближайшие дни на Землю упадет советская межпланетная станция «Космос-482» весом в полтонны,"Речь идет о посадочном модуле станции «Космос-482», которая была запущена в 1972 году к Венере, но осталась на орбите Земли. Пока неизвестно, в какой именно день он упадет на Землю — ориентировочно это должно произойти в первой половине мая.","Станция была запущена в качестве дублера другой станции в рамках программы «Венера-8», но потерпела аварию и осталась на орбите Земли. На межпланетную траекторию станция не вышла из-за аварии разгонного блока, который прекратил работать раньше положенного.
В большинстве случаев падение космических аппаратов не становятся большой проблемой, когда они сгорают в атмосфере, либо когда такое падение контролируют с Земли. Однако «Космос-284» будет падать бесконтрольно, и, скорее всего, не полностью разрушится в атмосфере.
Как рассказал «Русской службе Би-би-си» аналитик ракетных пусков Георгий Тришкин, аппарат был рассчитан для более жесткого входа в атмосферу Венеры, поэтому его тепловой экран и герметичный отсек, скорее всего, переживут вход в атмосферу.
По его словам, расчеты на параметрах орбиты указывают, что область падения обломков почти полностью пролегает над сушей, скорее всего, над территорией Египта, Сирии, Турции и Азербайджана, поэтому есть риск падения модуля в жилые районы.","**В ближайшие дни на Землю упадёт советская межпланетная станция «Космос-482» весом в полтонны**

По информации из доступных источников, в первой половине мая на Землю может упасть советский космический аппарат «Космос-482». Это посадочный модуль межпланетной станции, которая была запущена в 1972 году к Венере, но осталась на орбите Земли.

Пока неизвестно, в какой именно день модуль «Космос-482» упадёт на Землю.","**Роскосмос прокомментировал ситуацию с падением советской межпланетной станции «Космос-482»**

МОСКВА, 27 апреля. /ТАСС/. В первой половине мая ожидается неконтролируемый вход в атмосферу Земли советского посадочного модуля станции «Космос-482». Об этом сообщили в Роскосмосе.

Станция «Космос-482» была запущена в 1972 году в рамках советской космической программы. По информации Роскосмоса, аппарат остался на орбите Земли.

В ведомстве подчеркнули, что ведётся мониторинг ситуации и предпринимаются все необходимые меры для обеспечения безопасности.

Роскосмос продолжит информировать общественность о развитии ситуации в соответствии с установленными процедурами.","**Советская межпланетная станция «Космос-482» весом в полтонны упадёт на Землю в первой половине мая**

*Посадочный модуль станции «Космос-482», запущенной в 1972 году к Венере, но так и не добравшейся до места назначения, скоро вернётся на Землю. Пока неизвестно, в какой именно день это произойдёт.*

**Что известно о «Космосе-482»?**

«Космос-482» — это советская автоматическая межпланетная станция, которая была запущена в 1972 году с целью исследования Венеры. Однако из-за технической неисправности она осталась на орбите Земли. Теперь, спустя более 50 лет, станция готовится к возвращению на планету.

По данным экспертов, на данный момент траектория спуска «Космоса-482» не позволяет точно определить место и время падения. Ориентировочно это должно произойти в первой половине мая.

**Какие могут быть последствия?**

Специалисты отмечают, что вероятность того, что фрагменты станции причинят вред людям или инфраструктуре, крайне мала. Большая часть конструкции сгорит в атмосфере Земли, а оставшиеся обломки, скорее всего, упадут в океан или в малонаселённой местности.

Тем не менее, эксперты призывают следить за официальными сообщениями и не игнорировать возможные предупреждения.

**Как реагируют на ситуацию?**

Представители космических агентств пока не дают конкретных комментариев по поводу ситуации с «Космосом-482». Однако они отмечают, что подобные инциденты требуют внимательного мониторинга и анализа.

Некоторые эксперты считают, что возвращение «Космоса-482» на Землю может стать напоминанием о необходимости более тщательного контроля за космическими объектами и разработки мер по предотвращению подобных ситуаций в будущем.

**Альтернативные точки зрения**

Несмотря на общую уверенность в том, что риск для населения минимален, некоторые специалисты призывают к осторожности и рекомендуют следить за официальными заявлениями. Они подчёркивают, что даже небольшие фрагменты, которые могут достичь поверхности Земли, могут представлять опасность в случае падения в густонаселённых районах.

Другие эксперты отмечают, что подобные события являются частью космической деятельности и что важно продолжать исследования и разработки в области космонавтики, несмотря на возможные риски.

Мы будем следить за развитием ситуации и сообщать вам о любых новых данных.","**В ближайшие дни на Землю упадёт советская межпланетная станция «Космос-482» весом в полтонны**

*Посадочный модуль станции «Космос-482», запущенной в 1972 году к Венере, но так и не достигшей цели, может упасть на Землю в первой половине мая.*

Специалисты сообщают, что советский аппарат «Космос-482», который должен был отправиться к Венере, в ближайшее время может войти в атмосферу Земли и частично упасть на её поверхность. Пока неизвестно, в какой именно день это произойдёт, но предварительно это должно случиться в первой половине мая.

«Космос-482» — это посадочный модуль советской межпланетной станции, которая была запущена в 1972 году. Из-за технических неисправностей аппарат остался на орбите Земли и с тех пор находится в космосе.

Сейчас специалисты следят за траекторией движения «Космоса-482» и пытаются предсказать, когда и где он может упасть. Однако точные данные пока не известны.

Подобные ситуации могут вызывать опасения относительно безопасности, поскольку неясно, какие части аппарата могут достичь поверхности Земли и где именно они приземлятся. Однако специалисты утверждают, что подобные инциденты не являются редкими и находятся под их контролем.

Мы будем следить за развитием ситуации и сообщать вам о любых новых данных."
"Ученые создали лекарство, нейтрализующее яд 19 самых смертоносных змей","Американские ученые разработали противоядие, использовав уникальные антитела из крови мужчины, который сознательно вырабатывал иммунитет к змеиному яду, вводя себе небольшие дозы более 800 раз в течение 18 лет. Исследование опубликовано в научном журнале Cell.","Согласно исследованию, испытания на мышах показали, что новый антидот оказался эффективным против нейротоксинов 19 видов змей, включая мамб и кобр.
Разработать лекарство ученым помог американец Тим Фриде, герпетолог, который практиковал митридатизм — сознательное введение яда для выработки устойчивости. После сотен инъекций и укусов в крови Фриде выработались антитела. Ученые взяли у него образец крови и получили крупные партии антител для дальнейших испытаний.
Каждое из антител проходило испытания на мышах, которым вводили смертельную дозу змеиных ядов. Антитела обеспечили полную защиту от токсинов 13 видов змей, еще в шести случаях эффект оказался частичным.
При этом традиционные противоядия обычно действуют лишь против одного-двух видов. Теперь ученые планируют протестировать препарат на собаках, которые часто становятся жертвами укусов змей, а также разработать аналогичный препарат для семейства гадюковых.","**Учёные создали лекарство, нейтрализующее яд 19 самых смертоносных змей**

Американские учёные разработали новое противоядие, способное нейтрализовать яд 19 наиболее опасных змей. В основе лекарства лежат уникальные антитела, полученные из крови мужчины, который сознательно вырабатывал иммунитет к змеиному яду.

Согласно опубликованному исследованию в научном журнале Cell, этот человек вводил себе небольшие дозы яда более 800 раз на протяжении 18 лет. Полученные из его крови антитела стали ключевым компонентом нового противоядия.

Разработка такого лекарства является значительным достижением в области медицины и может спасти множество жизней в регионах, где змеиные укусы представляют серьёзную угрозу для населения.","**Американские учёные разработали противоядие против яда 19 самых опасных змей**

В научном журнале Cell опубликовано исследование американских учёных, которые разработали противоядие, способное нейтрализовать яд 19 наиболее смертоносных змей.

Согласно публикации, в основе разработки лежит использование уникальных антител, полученных из крови мужчины, который в течение 18 лет сознательно вырабатывал иммунитет к змеиному яду, вводя себе небольшие дозы более 800 раз.

Данное открытие может стать значительным вкладом в область медицины и здравоохранения, особенно в регионах, где распространены змеиные укусы. Разработка такого противоядия позволит спасать жизни людей, пострадавших от укусов опасных змей.","### Учёные создали лекарство, нейтрализующее яд 19 самых смертоносных змей

**Американские учёные разработали универсальное противоядие, использовав уникальные антитела из крови мужчины, который сознательно вырабатывал иммунитет к змеиному яду. Исследование опубликовано в научном журнале Cell.**

В ходе исследования специалисты обнаружили антитела в крови человека, который в течение 18 лет вводил себе небольшие дозы яда 19 самых опасных змей. Этот метод, известный как прививание, позволил ему выработать иммунитет к змеиному яду.

Полученные антитела учёные использовали для создания противоядия, которое показало высокую эффективность в нейтрализации ядов этих видов змей. Результаты исследования могут стать прорывом в области лечения укусов змей и спасти множество жизней в регионах, где змеиные укусы представляют серьёзную угрозу для здоровья населения.

Однако эксперты предупреждают, что подобные эксперименты с прививанием могут быть крайне опасными и не рекомендуются для самостоятельного проведения. Разработка универсального противоядия — сложный и трудоёмкий процесс, требующий глубоких знаний в области медицины и токсикологии.

По данным Всемирной организации здравоохранения, ежегодно от укусов змей страдают более 5,5 миллиона человек, при этом около 138 тысяч случаев заканчиваются летальным исходом. Новый препарат может значительно снизить эти цифры и стать настоящим спасением для жителей регионов, где распространены опасные змеи.

Тем не менее, несмотря на перспективы, связанные с новым противоядием, эксперты подчёркивают необходимость дальнейших исследований и клинических испытаний для подтверждения его эффективности и безопасности. Кроме того, потребуется решить вопросы, связанные с производством и распространением препарата в странах, где он наиболее востребован.","### Учёные создали лекарство, нейтрализующее яд 19 самых смертоносных змей

Американские учёные совершили прорыв в области медицины, разработав противоядие, способное нейтрализовать яд 19 самых опасных змей. В основе нового препарата лежат уникальные антитела, полученные из крови человека, который сознательно вырабатывал иммунитет к змеиному яду.

Как сообщает научный журнал Cell, исследовательская группа использовала антитела из крови мужчины, вводившего себе небольшие дозы змеиного яда более 800 раз в течение 18 лет. Такой подход позволил получить высокоэффективное средство, способное бороться с последствиями укусов самых смертоносных змей.

Змеиный яд представляет серьёзную угрозу для жизни и здоровья человека. Укусы змей могут вызывать болезненные реакции, отёк, паралич и даже смерть. Особенно опасны укусы таких видов, как чёрная мамба, тайпан и гадюка.

Разработка нового противоядия открывает перспективы для спасения жизней людей, пострадавших от укусов змей. Это особенно актуально для регионов с высоким риском встречи с опасными пресмыкающимися.

Специалисты отмечают, что новое лекарство может стать настоящим спасением для жителей тропических стран, где змеи представляют серьёзную опасность. Кроме того, препарат может быть использован для лечения пострадавших от укусов змей в условиях дикой природы или при проведении научных исследований.

Дальнейшие исследования и клинические испытания позволят определить эффективность и безопасность нового противоядия. Однако уже сейчас можно говорить о значительном прогрессе в области разработки средств борьбы с последствиями укусов змей."
