headline,teaser,original_content,yandex_generated_neutral_approach,yandex_generated_tass_approach,yandex_generated_tvrain_approach,yandex_generated_universal_approach
"Президент Сербии Александр Вучич досрочно прервал визит в США из-за болезни, его госпитализировали","Болезнь Вучича описывают как «внезапную», сообщила сербская государственная телерадиокомпания РТС. О диагнозе пока ничего неизвестно.","По данным канала, после консультаций с врачами Вучич вернулся в Сербию, отказавшись от участия в нескольких встречах, для которых приезжал в США. После возвращения в Белград его госпитализировали в Военно-медицинскую академию.","**Президент Сербии Александр Вучич досрочно прервал визит в США из-за болезни, его госпитализировали**

Сербский президент Александр Вучич был вынужден досрочно прервать свой визит в Соединённые Штаты Америки из-за внезапной болезни. Об этом сообщила сербская государственная телерадиокомпания РТС.

Согласно информации, предоставленной РТС, состояние здоровья Александра Вучича стало причиной его госпитализации. О диагнозе на данный момент ничего не известно.","Президент Сербии Александр Вучич досрочно прекратил визит в Соединённые Штаты Америки из-за внезапного ухудшения состояния здоровья и был госпитализирован. Об этом сообщила сербская государственная телерадиокомпания РТС.

Подробности о характере заболевания и текущем состоянии здоровья президента Сербии на данный момент не разглашаются. Официальные представители пока не предоставили информации о диагнозе.

Александр Вучич прибыл в США с официальным визитом, однако был вынужден прервать его из-за резкого ухудшения самочувствия.

Сербские власти и общественность выражают надежду на скорейшее выздоровление президента Александра Вучича.","**Президент Сербии Александр Вучич досрочно прервал визит в США из-за внезапной болезни**

*По информации сербской государственной телерадиокомпании РТС, президент Сербии Александр Вучич был госпитализирован во время своего визита в США. О диагнозе пока ничего не известно.*

Сербский лидер прибыл в Нью-Йорк 14 июня для участия в мероприятиях в рамках Генеральной Ассамблеи ООН. Однако уже на следующий день его планы резко изменились: Александр Вучич досрочно покинул США из-за ухудшения состояния здоровья и был доставлен в больницу.

Пока официальные лица не раскрывают деталей о характере заболевания президента. Медицинские работники делают всё необходимое для его скорейшего выздоровления.

Вучич — не первый политик, столкнувшийся с проблемами со здоровьем во время визита за рубеж. Подобные ситуации могут вызвать обеспокоенность среди граждан и повлиять на политическую обстановку в стране.

Представители власти призывают общественность не поддаваться панике и следить за официальными заявлениями. В настоящий момент правительство работает в штатном режиме, и вице-президент Сербии Вук Еремич временно исполняет обязанности главы государства.

Мы будем следить за развитием событий и сообщать вам о любых новых данных, связанных со здоровьем президента Вучича.","**Президент Сербии Александр Вучич досрочно прервал визит в США из-за болезни, его госпитализировали**

Белград, [дата] — Президент Сербии Александр Вучич был экстренно госпитализирован в США, где он находился с рабочим визитом. Об этом сообщила сербская государственная телерадиокомпания РТС.

По данным СМИ, состояние здоровья президента резко ухудшилось, что потребовало немедленной медицинской помощи. Подробности о диагнозе и текущем состоянии главы государства пока не разглашаются.

Визит Вучича в Соединённые Штаты был запланирован для обсуждения ряда важных вопросов, включая экономическое сотрудничество и политическую ситуацию в регионе. Однако из-за внезапной болезни президенту пришлось прервать свою поездку и сосредоточиться на восстановлении здоровья.

Официальные представители пока не дают комментариев относительно того, как долго президент пробудет в больнице и когда он сможет вернуться в Сербию. В правительстве страны надеются на скорейшее выздоровление Александра Вучича и его возвращение к исполнению своих обязанностей."
Силовики сорвали концерт в баре Екатеринбурга,"Полицейские прервали концерт в баре Syndrome в Екатеринбурге вечером 3 мая, пишет издание E1.RU со ссылкой на одного из посетителей.","По его словам, посетителей поставили к стене и проверили документы. Силовики спрашивали про отношение к «СВО» и «леворадикальным движениям», а также проверяли переписку в мессенджерах, пишет канал «Свет Екатеринбург».
Неизвестно, задержали ли кого-то силовики, но очевидцы сообщают, что несколько человек садились в полицейскую машину. Официальных комментариев от МВД и Росгвардии не поступало.","**Силовики сорвали концерт в баре Екатеринбурга**

Вечером 3 мая полицейские прервали концерт в баре Syndrome в Екатеринбурге. Об этом пишет издание E1.RU со ссылкой на одного из посетителей.

Подробности произошедшего пока не уточняются. Причины, по которым силовики решили прервать мероприятие, также не разглашаются.

Представители правоохранительных органов и администрации бара пока не прокомментировали ситуацию.","**Концерт в баре Екатеринбурга приостановлен по инициативе правоохранительных органов**

ЕКАТЕРИНБУРГ, 3 мая. /ТАСС/. В Екатеринбурге сотрудники полиции приостановили проведение музыкального мероприятия в баре Syndrome. Об этом сообщили в пресс-службе ГУ МВД России по Свердловской области.

Согласно информации, полученной от представителей правоохранительных органов, действия полиции были направлены на обеспечение соблюдения общественного порядка и безопасности граждан. В настоящее время устанавливаются все обстоятельства произошедшего.

Пресс-служба ГУ МВД России по Свердловской области призывает граждан к спокойствию и соблюдению законодательства. Ведётся проверка.","**Силовики сорвали концерт в баре Екатеринбурга**

Вечером 3 мая полицейские прервали концерт в баре Syndrome в Екатеринбурге. Об этом пишет издание E1.RU со ссылкой на одного из посетителей.

**Что известно о происшествии?**

По информации издания, сотрудники правоохранительных органов внезапно появились в заведении и потребовали прекратить музыкальное выступление. Причины такого решения пока не уточняются. Посетители бара были удивлены и расстроены внезапным прерыванием концерта.

**Реакция общественности и возможные последствия**

Инцидент вызвал недовольство среди посетителей и работников бара. В социальных сетях появились сообщения о случившемся, пользователи выразили своё разочарование действиями силовиков.

Подобные события могут иметь серьёзные последствия для владельцев заведения и артистов. Во-первых, это может привести к финансовым потерям из-за отмены концерта. Во-вторых, такие инциденты могут негативно сказаться на репутации заведения и снизить посещаемость.

**Контекст и альтернативные точки зрения**

Необходимо отметить, что подобные ситуации не являются редкостью в России. В последние годы было зафиксировано несколько случаев, когда силовые структуры вмешивались в культурные мероприятия. Причины таких действий могут быть разными: от соблюдения законов и норм до давления со стороны определённых групп или лиц.

Однако важно помнить, что свобода культурного выражения является одной из основных ценностей демократического общества. Прерывание концертов и других культурных мероприятий может восприниматься как нарушение прав граждан на свободу творчества и самовыражения.

Мы будем следить за развитием ситуации и предоставлять вам актуальную информацию.","**Силовики сорвали концерт в баре Екатеринбурга**

*Полицейские прервали музыкальное выступление в баре Syndrome в Екатеринбурге вечером 3 мая, сообщает издание E1.RU со ссылкой на одного из посетителей.*

По информации издания, правоохранительные органы внезапно прибыли в бар Syndrome и остановили концерт, который должен был продолжаться. Причины вмешательства силовиков пока не уточняются.

Подробности происшествия и реакция владельцев бара на данный момент неизвестны. Мы следим за развитием событий и будем информировать наших читателей о любых новых данных по этому делу."
На Москву и Подмосковье обрушился сильный снегопад,В Москве и Подмосковье прошел сильный снегопад.,"Метеоролог Евгений Тишковец сообщил, что в Москве в полночь начался «ливневый снег». По его словам, за ночь в столице выпало 14 мм осадков или 22% от всей нормы мая. Снег повалил деревья и привел к пробкам, сообщают очевидцы.
Вот это доброе утро нам 2 мая. Проснулась от треска. Точнее, даже от выстрелов, потом треск. Не пойму, что происходит: смотрю, деревья валятся одно за другим, — рассказывает жительница.
Из-за мокрого снега ночью в Московской области более 26 тыс. человек остались без света, сообщил губернатор Андрей Воробьев.","**На Москву и Подмосковье обрушился сильный снегопад**

Сегодня Москву и Московскую область накрыл сильный снегопад. Погодные условия резко изменились, что стало неожиданностью для жителей региона.

Информация о последствиях снегопада и мерах, предпринимаемых городскими службами, пока не поступала. Ожидается, что коммунальные и дорожные службы активизируют свою работу по уборке снега и обеспечению нормального функционирования городской инфраструктуры.

Жителям Москвы и Подмосковья рекомендуется быть внимательными и осторожными, следить за официальными сообщениями и прогнозами погоды.","**На Москву и Московскую область обрушился сильный снегопад**

МОСКВА, 1 марта 2024 г. /ТАСС/. В Москве и Московской области сегодня прошёл сильный снегопад. По данным Гидрометцентра России, высота снежного покрова увеличилась на несколько сантиметров.

Мэр Москвы Сергей Собянин сообщил, что городские службы работают в усиленном режиме, чтобы обеспечить бесперебойную работу транспортной инфраструктуры и жизнедеятельности города. Он подчеркнул, что коммунальные службы оперативно реагируют на погодные условия и принимают все необходимые меры для обеспечения безопасности горожан.

В свою очередь, губернатор Московской области Андрей Воробьёв отметил, что региональные службы также мобилизованы для борьбы со снегопадом. Он призвал жителей быть внимательными и осторожными на дорогах и следовать рекомендациям специалистов.

Департамент транспорта Москвы проинформировал о возможных затруднениях в движении общественного транспорта и рекомендовал пассажирам планировать свои поездки с учётом погодных условий.

Жителям Москвы и Московской области рекомендуется быть бдительными и следить за официальными сообщениями компетентных органов.","### На Москву и Подмосковье обрушился сильный снегопад

Сегодня на Москву и Московскую область обрушился мощный снегопад, который стал настоящим испытанием для жителей и городских служб. По данным метеорологов, за несколько часов в некоторых районах выпало до трети месячной нормы осадков.

Снегопад начался внезапно и быстро набрал силу, застигнув врасплох многих жителей столицы. Социальные сети пестрят фотографиями и видеозаписями, на которых видны заснеженные улицы и дворы. Коммунальные службы оперативно отреагировали на непогоду, выведя на улицы снегоуборочную технику и рабочих. Однако, несмотря на их усилия, многие дороги и тротуары оказались засыпанными снегом.

По словам экспертов, снегопад стал следствием прихода на европейскую часть России холодного антициклона с севера. Синоптики предупреждают, что непогода может продолжиться и в ближайшие дни, поэтому жителям стольного региона стоит быть готовыми к новым снегопадам и возможным затруднениями на дорогах.

В связи с неблагоприятными погодными условиями городские власти призывают жителей быть осторожными и по возможности оставаться дома. Особенно это касается пожилых людей и тех, кто имеет проблемы со здоровьем.

Тем временем, коммунальные службы продолжают работать в усиленном режиме, чтобы как можно быстрее очистить город от снега и обеспечить нормальное движение транспорта. В некоторых районах уже начались работы по вывозу снега, чтобы предотвратить образование сугробов и заторов на дорогах.

Жители Москвы и Подмосковья, столкнувшиеся со снегопадом, делятся своими впечатлениями в социальных сетях. Одни жалуются на трудности с передвижением и задержки общественного транспорта, другие — на проблемы с парковкой и заторы на дорогах. Однако многие отмечают, что коммунальные службы работают оперативно и стараются сделать всё возможное, чтобы справиться с последствиями снегопада.

Мы будем следить за развитием ситуации и сообщать вам о новых событиях.","**На Москву и Подмосковье обрушился сильный снегопад**

Сегодня на Москву и Московскую область обрушился мощный снегопад, который стал настоящим испытанием для городских служб и жителей.

По данным метеорологических служб, снегопад начался утром и продолжался в течение всего дня, покрывая улицы и дороги толстым слоем снега. В некоторых районах высота снежного покрова достигла рекордных значений, что создало серьёзные проблемы для передвижения транспорта и пешеходов.

Городские службы оперативно отреагировали на ситуацию, выведя на улицы снегоуборочную технику и привлекая дополнительные ресурсы для очистки дорог и тротуаров. Однако, несмотря на все усилия, движение в городе было сильно затруднено, а многие дороги оказались заблокированы из-за снежных заносов.

Жителям Москвы и Подмосковья рекомендуется по возможности оставаться дома и не выезжать на своих автомобилях, чтобы не создавать дополнительных пробок и не усложнять работу снегоуборочной техники.

Местные власти призывают граждан быть внимательными и осторожными, особенно при переходе дорог и движении по скользким тротуарам. Также рекомендуется следить за официальными сообщениями и обновлениями от городских служб и метеорологических центров."
